{
  "$schema": "./schemas/versions.schema.json",
  "schemaVersion": 1,
  "current": "v0",
  "versions": [
    {
      "id": "v0",
      "label": "v0 prerelease",
      "channel": "prerelease",
      "route": "/docs",
      "source": "workspace"
    }
  ],
  "routePolicy": {
    "currentMajor": "/docs",
    "maintainedMajor": "/docs/v{major}",
    "sourceDirectoriesAreVersioned": false
  }
}
